[{"trip_id": "trip-00001", "vehicle_id": "veh-00001", "driver_id": "driver-00001", "shipment_id": "ship-00001", "route_id": "route-00001", "planned_start": "2026-10-25T01:17:42Z", "planned_end": "2026-10-25T02:17:42Z", "actual_start": "2026-10-25T01:17:42Z", "actual_end": null, "origin": "Cairo Distribution Center", "destination": "Delivery Zone 01", "trip_status": "in_progress", "distance_km": null, "fuel_used_liters": null}, {"trip_id": "trip-00002", "vehicle_id": "veh-00002", "driver_id": "driver-00002", "shipment_id": "ship-00002", "route_id": "route-00002", "planned_start": "2026-10-25T01:17:42Z", "planned_end": "2026-10-25T02:17:42Z", "actual_start": "2026-10-25T01:17:42Z", "actual_end": null, "origin": "Cairo Distribution Center", "destination": "Delivery Zone 02", "trip_status": "in_progress", "distance_km": null, "fuel_used_liters": null}, {"trip_id": "trip-00003", "vehicle_id": "veh-00003", "driver_id": "driver-00003", "shipment_id": "ship-00003", "route_id": "route-00003", "planned_start": "2026-10-25T01:17:42Z", "planned_end": "2026-10-25T02:17:42Z", "actual_start": "2026-10-25T01:17:42Z", "actual_end": null, "origin": "Cairo Distribution Center", "destination": "Delivery Zone 03", "trip_status": "in_progress", "distance_km": null, "fuel_used_liters": null}]